{
  "version": "v1",
  "strandCount": 15,
  "strands": [
    {
      "name": "Academic Language",
      "domains": [
        "VOC",
        "PHR",
        "REG",
        "GRM",
        "SEN"
      ]
    },
    {
      "name": "Academic Discourse",
      "domains": [
        "COH",
        "STA",
        "FUN"
      ]
    },
    {
      "name": "Academic Reading",
      "domains": [
        "RDP",
        "RDS",
        "RDC"
      ]
    },
    {
      "name": "Academic Listening",
      "domains": [
        "LIS",
        "NTK"
      ]
    },
    {
      "name": "Academic Speaking",
      "domains": [
        "SEM",
        "PRS",
        "PRN",
        "GRW"
      ]
    },
    {
      "name": "Academic Writing",
      "domains": [
        "WPR",
        "PAR",
        "ESS",
        "EDT"
      ]
    },
    {
      "name": "Sources & Academic Integrity",
      "domains": [
        "INF",
        "SRC",
        "SYN",
        "CIT",
        "INT"
      ]
    },
    {
      "name": "Argument & Critical Thinking",
      "domains": [
        "CRT",
        "ARG",
        "IDN"
      ]
    },
    {
      "name": "Academic Genres",
      "domains": [
        "GES",
        "GRP"
      ]
    },
    {
      "name": "Research Communication",
      "domains": [
        "RES",
        "PUB"
      ]
    },
    {
      "name": "Data, Numeracy & Multimodality",
      "domains": [
        "DAT",
        "NUM",
        "MMD"
      ]
    },
    {
      "name": "Learning & Autonomy",
      "domains": [
        "LRN",
        "FBK",
        "EXM",
        "TST"
      ]
    },
    {
      "name": "Academic Socialisation & Communication",
      "domains": [
        "ACU",
        "PRG"
      ]
    },
    {
      "name": "Digital Literacy & AI",
      "domains": [
        "DIG",
        "GAI"
      ]
    },
    {
      "name": "Disciplinary Literacies",
      "domains": [
        "DSE",
        "DHL",
        "DBE",
        "DLW",
        "DSS",
        "DHU",
        "DAD"
      ]
    }
  ],
  "domainCount": 51,
  "domains": [
    {
      "code": "VOC",
      "strand": "Academic Language",
      "name": "Academic Vocabulary",
      "summary": "Academic Vocabulary covers the lexical platform for university study: the vocabulary size and text coverage needed to read and listen independently; the general academic, sub-technical and technical layers of university lexis; the word-level knowledge (morphology, word grammar, countability, spelling) needed for accurate production; and the strategies learners use to keep expanding vocabulary beyond the classroom. Academic word lists (AWL, AVL) are treated as useful but contested starting points, because the 'academic' status, meaning and frequency of items vary by discipline, and coverage thresholds are treated as approximate planning guides rather than cut-offs.",
      "learnerSummary": "You will learn which words are most worth your time for university study, how to learn and remember them efficiently, and how to use them accurately and precisely in your own writing and speaking.",
      "stageEmphasis": {
        "foundation": "Secure the high-frequency base, word families and the vocabulary of university study and assignments, and establish independent learning routines with dictionaries and word cards.",
        "pre-sessional": "Build general academic vocabulary with its word grammar and collocations, set realistic size goals from coverage research, and practise inferring and checking meaning from context.",
        "in-sessional-ug": "Move academic and sub-technical vocabulary into accurate productive use within the student's discipline, including process verbs, evaluative lexis and discipline-specific senses.",
        "in-sessional-pgt": "Prioritise disciplinary terminology, lexical precision and evaluation for source-based writing on compressed one-year programmes.",
        "pgr": "Refine precision, shell nouns and evaluative lexis for research writing, using evidence from the target field's literature."
      },
      "keyReferences": [
        "nation2013",
        "coxhead2000",
        "gardnerdavies2014",
        "hylandtse2007",
        "webbnation2017",
        "schmitt2011"
      ]
    },
    {
      "code": "PHR",
      "strand": "Academic Language",
      "name": "Phraseology & Formulaic Language",
      "summary": "Phraseology & Formulaic Language treats multi-word units — collocations, lexical bundles, spoken formulas and fixed expressions — as core carriers of academic meaning rather than decorative extras. Corpus research shows that expert academic writing and speech rely heavily on recurrent combinations whose functions differ (research-, text- and stance-oriented) and vary by discipline, and that L2 and novice writers tend to underuse, misuse or overuse them. The domain also develops strategies (corpus consultation, critical use of phrase resources) so that learners can verify phraseology independently, while guarding against formulaic, template-driven text.",
      "learnerSummary": "You will learn to notice and use the word combinations that academic writers and lecturers rely on, and to check combinations yourself with corpora and phrase resources without filling your writing with stock phrases.",
      "stageEmphasis": {
        "foundation": "Build the habit of noticing and recording combinations, with frequent academic collocations and text-organising bundles from course materials.",
        "pre-sessional": "Extend collocational range, introduce research- and stance-oriented bundles linked to calibration, and train learners in collocation dictionaries, simple corpus searches and critical phrasebank use.",
        "in-sessional-ug": "Work on learners' own drafts: repair persistent miscollocations, reduce overused connectors and stance frames, and compare bundles with those in disciplinary texts.",
        "in-sessional-pgt": "Prioritise discipline-relevant collocations and bundles for source-based writing, checked against field texts in a compressed timeframe.",
        "pgr": "Profile the phraseology of target journals with self-built corpora and refine stance formulas for research writing and publication."
      },
      "keyReferences": [
        "nesselhauf2003",
        "hyland2008bundles",
        "simpsonvlachellis2010",
        "ackermannchen2013",
        "biber2004bundles",
        "boultoncobb2017"
      ]
    },
    {
      "code": "REG",
      "strand": "Academic Language",
      "name": "Register & Academic Style",
      "summary": "Register & Academic Style develops learners' ability to read a communicative situation and choose language accordingly: register as a configuration of field, tenor and mode; the systematic differences in how speech and writing package meaning; and the features conventionally associated with formal academic prose. The domain deliberately treats style 'rules' as probabilistic tendencies to be tested against evidence of disciplinary and historical variation, frames impersonality as a choice about agency rather than a route to objectivity, and extends to inclusive language and to writing for non-specialist readers.",
      "learnerSummary": "You will learn why academic writing and speech sound the way they do, how to adjust your style for different readers, purposes and disciplines, and how to tell real conventions from over-simplified 'rules'.",
      "stageEmphasis": {
        "foundation": "Build register awareness through concrete contrasts (email, forum post, assignment) and an explicit, reasoned checklist of formality features, including precise rather than vague reference.",
        "pre-sessional": "Make spoken–written differences and formality choices explicit tools for reading-into-writing and presentations, and begin testing prescriptive style rules against exemplars.",
        "in-sessional-ug": "Reconcile conflicting module advice by examining disciplinary style, authorial presence and density in the student's own field and genres.",
        "in-sessional-pgt": "Calibrate density, impersonality and inclusive description for compressed source-based and professional writing, often in an unfamiliar discipline.",
        "pgr": "Align style with target journals and examiners' fields, claim contribution with appropriate presence, and write lay summaries and engagement texts for non-specialists."
      },
      "keyReferences": [
        "biberconrad2019",
        "halliday1989",
        "bibergray2010",
        "hylandjiang2017",
        "changswales1999",
        "hyland2004disciplinary"
      ]
    },
    {
      "code": "GRM",
      "strand": "Academic Language",
      "name": "Academic Grammar",
      "summary": "This domain covers the grammatical resources that carry meaning in academic registers, prioritised by what corpus research shows academic writing actually does rather than by a general-English syllabus order. Its centre of gravity is the noun phrase: academic prose compresses information into premodified and postmodified noun phrases and nominalisations far more than conversation does, so learners need both to unpack such phrases when reading and to build them when writing. Clause-level resources (tense, voice, modality, subordination, complement and reporting clauses) are treated in terms of the rhetorical choices they serve, such as currency in citation, agency in methods and degrees of commitment in claims. Accuracy topics are framed as monitoring and editing problems as much as knowledge problems.",
      "learnerSummary": "You will learn the grammar that academic texts rely on most, especially how long noun phrases pack information, and how choices of tense, voice and sentence structure change what your writing claims. You will also build routines for finding and fixing your own most frequent errors.",
      "stageEmphasis": {